title,body
『人は確認し付き合ってみてはじめて分かる』,人間は外側を見たら、みんな同じだ。 分からない。付き合ってみてはじめて分かる。 いい人悪い人、外側を見たら同じだ。 誘惑者も惑わす者も、義人たちも、 見た目は同じだ。 誰が分かるか。 付き合ってみて確認すれば分かる。 人間はそれぞれどう作るかにかかっている。 月明洞を作って、美しく神秘的になった。 各自、自分を作りなさい。変化させなさい。 神様の愛の対象に、知恵も人格も作りなさい。 自分の体も心も考えも愛体になるように、 神秘的に作りなさい。 喜びと理想の世界だ。 黄金の天国、輝く引き上げの霊になるように 作りなさい。永遠な栄光の霊だ。 人間はそれぞれどう作るかにかかっている。 月明洞を作って、美しく神秘的になった。 各自、自分を作りなさい。変化させなさい。 神様の愛の対象に、知恵も人格も作りなさい。 自分の体も心も考えも愛体になるように、 神秘的に作りなさい。 喜びと理想の世界だ。 黄金の天国、輝く引き上げの霊になるように 作りなさい。永遠な栄光の霊だ。 永遠な栄光の霊だ。 永遠な栄光の霊だ。
人は確認し接してみてはじめて分かる,人は外側皆同じだ 分からない　接してこそ分かる 良い人悪い人外側同じだ 誘惑し惑わす人も　義人も見た目は同じ 見分けられるか　接して確認し分かる 人は　それぞれ　どう作るかだ 月明洞作って　神秘で美しくなった 各自自分を作れ　変化させよ 神の愛の対象に　知恵も人格も作れ 体も心も考えも　 愛になるように神秘に作りなさい 歓喜と理想の世界 黄金天国光る引き上げの霊に作れ 永遠な　栄光の霊だ  人は外側皆同じだ 分からない　接してこそ分かる 良い人悪い人外側同じだ 誘惑し惑わす人も　義人も見た目は同じ 見分けられるか　接して確認し分かる 人は　それぞれ　どう作るかだ 月明洞作って　神秘で美しくなった 各自自分を作れ　変化させよ 神の愛の対象に　知恵も人格も作れ 体も心も考えも　 愛になるように神秘に作りなさい 歓喜と理想の世界 黄金天国光る引き上げの霊に作れ 永遠な　栄光の霊だ 永遠な　栄光の霊だ 永遠な　栄光の霊だ
引き上げ最高の復活だ,引き上げ最高の復活だ 引き上げ最高の復活だ 御子の新婦に　　復活だ 御子の新婦に　　復活 引き上げ最後の復活だ 引き上げ最高の復活だ 愛の変化の復活だ 御子の新婦に変化した  何をしても　主と愛一体で どこに行っても　主の愛伝える 何をしても　主と心情一体で どこに行っても　誰と会っても 主に祈って 天の御旨を成す 主の御旨成そう 復活　　日々自分の変化 復活　　主の考え心で 引き上げ　　日々変化だ 引き上げ　　ただ主の愛で 引き上げ　　変化　　変化 引き上げ　　ただ主愛で 引き上げ最高の復活だ 引き上げ最高の復活だ 御子の新婦に復活だ 御子の新婦に 御子の新婦に　復活だ 御子の新婦に復活 引き上げ最高の復活だ 引き上げは永遠な復活だ 復活だ 復活だ
ふるさと,南の空 山 向こう 故郷 こきょう に春が来て 月明洞にサツキも 赤く咲いた 時に従う人々　押し寄せるが 　 待っているわが主は 来られない 摂理国　月明洞に　四季折々 雄大で 美しく 神秘的だ 時に従う人々 押し寄せて来る 自然聖殿に 聖三位も 来られたと言うことだ 時に従う人々 押し寄せて来る 自然聖殿に 聖三位も 来られたと言う ことだ
葬りなさい,古いもの 葬って 新しいもの 見つけなさい 古いもの 過ぎ去った 見よ 新しいものだ 探してた宝だ 古いもの 捨てた人 輝く世界に住む 神様 引き上げ成し 永遠な 愛の世界だ 永遠な 栄光の世界だ  古いもの 捨てた人 輝く世界に住む 聖霊が 喜ばれ 主と実践する 愛と引き上げの歴史だ  新しいもの 迎えた人 喜び 宴会する 引き上げ 愛の世界だ 輝く理想世界だ 平和と愛の世界だ 古いもの 捨てた人 主と同行する 引き上げ 成した人 一日が千年のようだ 喜びと愛の極だ 死人を未だに 葬らず生きる人 悲しく つらく生きる 引き上げの 黄金の時間 最後に 過ぎてゆく 最後に 過ぎてゆく 最後に 過ぎてゆく
法は神様でいらっしゃる,黄金天国に来て 永遠に愛し生きようと 『しなさい』『するな』 命の愛の法を下さった 法は神様だ　御言葉だ　 　 あなたを守り　保護する どこに行っても神 の 御言葉の人法と天法だ 御言葉の法で　自分もサタンも世も治めよ 喜びの生　希望の生　全能な三位体 　 同行する生活だ 栄えと祝福の法だ 完全な生の生活の法だ 命の法を破ったら 死亡の道　苦痛の道だ 　 行なえば愛を成し 引き上げ黄金天国 霊も肉も幸せだ
走ろう 走ろう 降りだす前に,聖霊 聖霊様 私に あのよう このよう 目配せしてくださったが 私 分かったのです 未練もなく走った 喜び 行なった 神様 見て 拍手もして 聖霊様は ついてきて さあ 走ろう 降りだす前にやるべきだ 瞬間の機会だといつもおっしゃった 感動をくれた 悟らせた 今日も終わってみたらそうだった これ以上 疑いも 確認も することない  神様 聖霊様 今はわれら行きます 嬉しく喜んで われらと行なわれる 聖霊様に仕えてゆきます アンニョン アンニョン
埠頭の孤独,時になり 渡り鳥のよう 押し寄せる あの人々　どこへ行き 呼ぶ人 今は 一人もいない 私の顔だけ　窓に映るのだなぁ 見知らぬ他国で 野原を 雨に濡れた列車が 走ってゆく 汽笛だけ 雨に濡れて 悲しく泣くのだなぁ  見知らぬ他国で 野原を 雨に濡れた列車が 走ってゆく 汽笛だけ 雨に濡れて 悲しく泣くのだなぁ 悲しく泣くのだなぁ
ただ神様,人間の力ではだめだ　神の力でだ 人間の力で生きられない 勝手に生きられない 神様遣わしたメシアと生きなさい 運命は予定ではない 行いと御旨によって変わる 運命は命と死亡の道があって 各自どちらへ行くかで左右されるのだ 行ないにより運命が変わる 運命が変わる
ただ神様 唯有 神,人間の力ではだめだ　神の力でだ 憑著人的力量 人的能力 無法做到 要憑著 神的力量 人間の力で生きられない 勝手に生きられない 人無法隨心所欲來使用 憑人的力量 無法生活 神様遣わしたメシアと生きなさい 人必須與神所差派的 救援者一起生活 運命は予定ではない 行いと御旨によって変わる 所謂命運 並非起初就預定 命運左右於自己的行為以及神的旨意 運命は命と死亡の道があって 所謂命運 路本身已定 有生命路 和死亡路 兩條路 各自どちらへ行くかで左右されるのだ 會按照自己如何去尋找 左右走上哪條道路 行ないにより運命が変わる 運命が変わる 自己如何去行動 會左右自己命運 會左右自己命運  人間の力ではだめだ　神の力でだ 憑著人的力量 人的能力 無法做到 要憑著 神的力量 人間の力で生きられない 勝手に生きられない 人無法隨心所欲來使用 憑人的力量 無法生活 神様遣わしたメシアと生きなさい 人必須與神所差派的 救援者一起生活 運命は予定ではない 行いと御旨によって変わる 所謂命運 並非起初就預定 命運左右於自己的行為以及神的旨意 運命は命と死亡の道があって 所謂命運 路本身已定 有生命路 和死亡路 兩條路 各自どちらへ行くかで左右されるのだ 會按照自己如何去尋找 左右走上哪條道路 行ないにより運命が変わる 運命が変わる 自己如何去行動 會左右自己命運 會左右自己命運  各自どちらへ行くかで左右されるのだ 會按照自己如何去尋找 左右走上哪條道路 行ないにより運命が変わる 自己如何去行動 會左右自己命運 運命が変わる 會左右自己命運
対話しなさい,神が助けた過ぎた日 忘れ 感謝も愛もできません 現在 いま が大事だ その時ごと 対話しなさい 現在 いま の為に助けた 現実で行えば 過ぎた日 咲いた　花が実を結ぶ 日ごと 私と対話だ 今は 新婦の愛の生だ  神が助けた過ぎた日 忘れ 感謝も愛もできません 現在 いま が大事だ その時ごと 対話しなさい 現在 いま の為に助けた 現実で行えば 過ぎた日 咲いた　花が実を結ぶ 日ごと 私と対話だ 今は 新婦の愛の生だ
騙されるな　外側を見るだけではわからない,良い人悪い人 外側 同じだ 確認して接し 初めてわかる わからずやられたら 胸を叩き 悔しい 神様 聖霊に尋ねたら 悟れるよう 霊感、感動くださる 様々 物質、異性 誘惑し だます 気づいて 背を向けよ 惑わす人の事 学んで 神になり 治めよ 神様 聖霊 主と共に いつも 行なえ 世が邪悪で 騙す者 幅をきかせてる 悪人も善人も 時になれば 神が 明るみに出す  良い人悪い人 外側 同じだ 確認して接し 初めてわかる わからずやられたら 胸を叩き 悔しい 神様 聖霊に尋ねたら 悟れるよう 霊感、感動くださる 様々 物質、異性 誘惑し だます 気づいて 背を向けよ 惑わす人の事 学んで 神になり 治めよ 神様 聖霊 主と共に いつも 行なえ 世が邪悪で 騙す者 幅をきかせてる 悪人も善人も 時になれば 神が 明るみに出す 神様 聖霊 主と共に いつも 行なえ 世が邪悪で 騙す者 幅をきかせてる 悪人も善人も 時になれば 神が 明るみに出す
立てられた愛の塔,主の光る 御言葉 光のよう 実践する人よ 千年間 婚宴 開く　 引き上げ成した 美しい新婦よ 主に命かけ 捧げた愛 未練なく生きて 主は 今 この時代 共に生きてる 新歴史の人よ 戻った兄弟よ 御言葉に 聖霊の御働きに 燃えてる人よ アーメンアーメン 変わらないと 手を取って決心したあなたよ 若者 黄金の胸に 愛の火をつけて 主は今 神の愛に酔っている 永遠な人よ 愛しいあなたよ 引き上げの御言葉 愛の歴史 聖霊燃える人よ 最後まで 摂理を行く 決断した 愛のあなたよ 主の火を噴く御言葉 叫び伝えて あなた 今どの位置で 生きてるのか 永遠な人よ 愛の新婦よ
立ち上がれ 光を放て,立ち上がれ 光 放て 光が近くに来た 今は走り走れ あなたへの神の目的がある 今はワシのように 天高く飛べ 聖霊の感動だ 　 主と共に ひとつになり 毎日 愛の翼広げ　次元を上げよ 　 あなたが　栄えるだろう どこに行っても 共にしてあげよう  聖霊だ 聞きなさい わたしと すべきことがある ひそかに これはやりなさい 探してた宝 用意しておいた 今はチーターのように 走り飛べ 聖霊の感動だ 聖霊と 知恵深く行え 大胆に話せ　分別し次元を上げよ 引き上げられた人　栄えるだろう どこに行っても 共にしてあげよう 立ち上がれ 光放て 光が近くに来た
滝の愛,一筋の滝のように 乱れもせず わが愛 天のため 流れ落ちた 滝のような わが愛は 変わらず 永遠だろう 神の創造目的 その愛 成し遂げて その形象 構想し 大傑作品 造られた 滝のような わが愛は 変わらず 永遠だろう  一筋の滝のように 乱れもせず わが愛 天のため 流れ落ちた 滝のような わが愛は 変わらず 永遠だろう 神の創造目的 その愛 成し遂げて その形象 構想し 大傑作品 造られた 滝のような わが愛は 変わらず 永遠だろう 滝のような わが愛は 変わらず 永遠だろう 変わらず 永遠だろう
誰が呼ぶのか,盗人のように来る主 夢ではない 誰が呼ぶのか この真夜中 主の声なのか 主の体 離れて 帰って来れないが 気をもんで 誰が呼び 愛の目を濡らすか あなたの元へ行く 呼んでみよ 誰が信じて行うのか 愛する者 実践する 愛する体着て 盗人のように来た わかるのか 主の姿を わが愛 呼んでみよ  愛する体着て 盗人のように来た わかるのか 主の姿を わが愛 呼んでみよ わが愛 呼んでみよ 愛の対話だ
チャッチャッ チャッチャックン ぺぺ ペペア,チャッチャッ チャッチャックン チャッチャッ チャッチャックン どこまでも われら チャッチャッ チャッチャックン チャッチャッ チャッチャッ ペアだ 神様 聖霊様 主の前で われら チャッチャッ チャッチャッ チャッチャックン ペアだ 離れたら 大変だ 別れたら 大変だ 大変だ 何にもならないのだ チャッチャッ チャッチャッチャッ チャッチャッチャッチャッ ペアなのだ 神様 聖霊 主は新郎で われら 新婦になって チャッチャッ チャッチャックン クン チャッチャッ クン チャッチャッ チャッチャッチャッ ペアだってば 一対のペアなのだ 愛は チャッ チャッ ペアだ チャッチャッチャッチャッ チャッチャッ 愛は チャッ チャッ ペアだ チャッチャッチャッチャッ チャッチャッ 愛は ペアなんだってば 今日も 神様とわれら チャックン ペアだ 日が昇り沈むまで ペアなのだ ペアなんだってば チャッチャッ チャッチャックン チャッチャッ チャッチャックン 主は頭になり われら 体になり 肢体になって 生きてゆく チャッチャッ チャッチャックン ペアだ 誰でも われらも 神様 愛の主体になり われら 対象になって 愛して 毎日 愛して 助けて 感謝し 生きてゆく運命 永遠な運命 チャッチャッ チャッチャックン ペアだ 愛は チャッ チャッ ペアだ チャッチャッチャッチャッ チャッチャッ 愛は チャッ チャッ ペアだ チャッチャッチャッチャッ チャッチャッ 愛は ペアなんだってば 今日も 神様とわれら チャックン ペアだ 日が昇り沈むまで ペアなのだ ペアなんだってば チャッチャッ チャッチャックン チャッチャッ チャッチャックン 春の日は 行く 愛の日は 今日も 行く 来て去る 来て去る チャッチャッチャッチャッ チャチャチャッ チャチャチャ チャッチャッチャッチャッ
誰が慰めるだろう,誰が私を呼ぶのか 四方を見ても　誰もいないのに 誰がわが心知って　慰めるだろうか 誰も知る人いないのに 誰が我が手首を　ぎゅっと握る 大きい手だけが見える 体も顔も見えないのに この大きい手　誰の手だろうか あなたを永遠に愛して慰める 心に聞こえてくる 全能でいらっしゃる神様だ 命救って　永遠に生かすと 苦痛が来るのだな 永遠に　あの黄金天国でも 地上でも　あなた　輝くだろう この身　天の体になり 神の手に握られ　生きてゆこう  あなたを永遠に愛して慰める 心に聞こえてくる 全能でいらっしゃる神様だ 命救って　永遠に生かすと 苦痛が来るのだな 永遠に　あの黄金天国でも 地上でも　あなた　輝くだろう この身　天の体になり 神の手に握られ　生きてゆこう この身　天の体になり 神の手に握られ　生きてゆこう
罪から自由を得させたのは,罪から自由にしたのは 悔い改め 願い求めだ 主の許しと愛だ 二度と 罪を 犯すな 主が自分の民を 罪から 救ってくださる 引き上げの新婦よ 清くしなさい 肉体も 魂体も 霊体も 瑕 きず なく 主の前に 来なさい 神霊なセノレ 歌って 聖三位に 栄光 帰しなさい 主と喜びの 愛だ 主が自分の民を 罪から 救ってくださる 引き上げの新婦よ 清くしなさい 肉体も 魂体も 霊体も 瑕 きず なく 主の前に 来なさい 神霊なセノレ 歌って 聖三位に 栄光 帰しなさい 主と喜びの 愛だ 愛だ　愛だ
天の心情,神様 創造目的 成すために 真理で 選ばれた人 探す主 その命に 向かう愛を 誰が知るだろう 悠久の歳月 神の愛 世の中に人々　多く多いが 聖三位 その心情 誰が知るか 愛と栄光 受くべき 創造主 しゅ 人間の堕落で 悲しみになったが 六千年の歴史で 愛成した 無限な愛を 捧げよう 地に向かう愛　海になった 聖三位 その心情 誰が知るか 神様 胸に秘めた思い 主の御言葉で 証するが イエスの時のよう みな　あざ笑う 暗闇の 墓で 満足するか 無知で無念な思い またするか 聖三位 その心情 誰が知るか  天 あめ が下　どんな怖いことも 神のさばきと 比べられず 信じて 急いで　従えば 聖霊の熱い 感動 感化 愛 主と黄金天国 行けるから それより大きな喜びあるか 六千年 創造目的 愛成した 聖三位 愛 歓喜 永遠だろう
天国実現,虚しいこの世で 主を知らなかったなら 今も世の中で 生きたでしょう 主 来た摂理史で 婚宴が始まった 地球村の人々 雲のよう押し寄せる 夢のような地上天国 今日はここで 主と私に この真理 なかったなら 今も世の中で 生きたでしょう 主 去った既成に 暗い夜 よ 深まる 主よ この手 心を 永遠につかんで 体も霊のように 喜び走る  主と私に この愛 なかったなら 虚しい愛で 生きたでしょう 新歴史 摂理で 主と御旨広げ ただ主だけ 見つめて 一片丹心 生きてゆく 体も霊のように 喜び走る ただ主だけ 見つめて 一片丹心 生きてゆく 体も霊のように 喜び走る
天上天下一の美の女性神 聖霊様,ある日 聖霊が 私に言った あなた この世 生きながら 美しい人を見たかと言うので 本当にたくさん見た と言ったら 聖霊 私を見るまで 美しい人を見たと言うな と言われたから 見せて 見せて 見せてください と言ったら 本当に 見せてくださったが びっくりして 心臓麻痺で死ぬかと思った びっくり仰天した 本当に 美しく 神秘的 全能者 それこそ 一言で言えば 全知全能で 美しくも美しく この世では表現しきれない 美しさ 一万言 いちまんこと 言っても 足りないばかりだった 聖霊様はおっしゃった この世で 美しいもの 見たら 私を象徴で見た と言いなさい 肝に銘じ わが言葉 深く深く刻んで 忘れるな 忘れるなとおっしゃった 驚き びっくり仰天 びっくり びっくり 全知全能 美しく 神秘的 この世で これ以上 表現できない びっくりして心臓麻痺 死ぬかと思った びっくり仰天 びっくり仰天 気絶 この世で 美しいもの 見たら 私を象徴で見た と言いなさい 肝に銘じ 忘れるな わが言葉 深く刻め 聖霊様 天上天下で 本当に美しくきれいで 言い表せないその姿 比喩で言うなら 太陽のようで 　 美しい キラキラ光る宝石のようだ あなたも 天母聖霊様を 見られないが 皆 みな 信じ 皆 みな 愛して 主のように 行なうなら 霊肉 美しさを われらも 持って行くことができる だから 化粧ばかりせず 装いばかりせず 聖霊様に 話して 美しさを証し 分かって 信じてあげ 愛していくなら あなたも 聖霊様のよう 美しさが だんだんと 成されてゆく 行なえ 忘れず 行なえ  天上天下一聖霊様 多くの神 肉体の中で 最高に 最先端に 美しい 全能者 女性神だ 天母聖霊様は 愛のかたまり 地球のかたまり 太陽のかたまり 宇宙全体のよう 愛のかたまりなのだ
天国はあなたの心に,天国が心にある　 心満足ないと　一万の満足ない 考え嬉しくないと　 美しい美も　喜びがない 心考え天国になれば　全て天国だ 心清くしなさい　考え清くしなさい 心に主と聖霊迎え 神様熱く愛し生きてゆこう 世の天国　愛の黄金天国だ
天母,うっとりと輝かしい あの夕焼け 眺めよ 不思議で神秘な美で 輝き 美しい  この世 霊の世界 あのように美しい美の女性 いるだろうか 天と地 愛する聖霊天母の姿だ 目では見ること難しいから 天地万物で映し見せる 会いたい時 毎日見よ 聖霊と話しなさい 呼んでみなさい 心で答えるだろう 話そう 対話しよう  うっとりと輝かしい あの夕焼け 眺めよ 不思議で神秘な美で 輝き 美しい
天地創造,第一　第一　第一の日 神は はじめに天と地　創造された 光あれ と言われ　光あり 神はその光見て　良しとされた 夕となり朝となった　第一の日だ 第二　第二　第二の日 神は 大空なる天を　創造された 水あれ と言われ　水があり 神は天と水見て　良しとされた 夕となり朝となった　第二の日だ 第三　第三　第三の日 神は陸と水を　分けられた 植物あれ と言われ　その通りに 草と実を結ぶ木見て　良しとされた 夕となり朝となった　第三の日だ 第四　第四　第四の日 神は日と月と星　創造された 夜と昼と季節　日をさだめ 神は日と月星見て　良しとされた 夕となり朝となった　第四の日だ 第五　第五　第五の日 神は生きものたちを　創造された 生きものあれ と言われ　その通りに 神は生きもの見て　良しとされた 夕となり朝となった　第五の日だ 第六　第六　第六の日 神は全ての動物　創造された 男と女神に似せて創り 人は万物治めよ と言われた 創造した全て見て　喜ばれた 第七　第七　第七の日 神は天地創造　終えられた 聖なるものとし祝し　休まれた 創造した天地見て　良しとされた 夕となり朝となった　第七の日だ
どの時代誰でも,どの時代 誰でも 決断の時ある 真 しん と偽 ぎ の戦い どちらに立つか 主がくれた真理で われらは決めた 光か暗闇 選んで生きよう 真理に住む人 強くて永遠だ 非真理で辛く ただ虚しくて 落胆し戻った 強者 つわもの 多い 主 迎えてくださる 喜び生きよう 中心者の精神 御旨に従い 責任果たして 前へと進もう 新時代に 新しい御言葉 くださる 真理で生きれば 失敗しない 無知に住む人 真理に逆らう 愛で覆って 主のように生きよう われらの歴史に 悪評 多いが 神様 共にし われら勝利した 神様 共にし われら勝利した 神様 共にし われら勝利した
時と共に,人々 時を待っても 時は待たずに去って行く 時は機会だ 時が来たら 時と共に 稲妻のよう行なえ 長い歳月 あれほど時を 待っていて 時が来たが 時を知らず　ただ寝てばかりいる 時は 地球が回り 来て去る どんな人も 止めることができず 行ってしまう 一度過ぎた時は 戻って来ないから 待ってた時 来たら　時と共に 行なえ 時になってこそ 寒く暑い 時になり 全て成されゆくから 天も地も 時を待つ わかって行なえば 肉も霊も 成し遂げ享受する 時を迎えた人 主と共に 愛して 理想世界 愛 引き上げ 天と地 黄金天国 永遠な世界だ 愛して 理想世界 愛引き上げ 天と地 黄金天国 永遠な世界だ
どうして今来たか,なぜ 今来たか 早く来ないで 神様 どんなに 待っていたか 人生の道 遠く 遠くて 急ぎ 行かねばならない これから われらは 行かねば 走り行かねば 主に従い 最後まで 終わりまで 行かねば 地上世界を経て 永遠な あの黄金天国 向かい 行かねばならない これから われらは 行かねば 走り行かねば 主に従い 最後まで 終わりまで 行かねば 地上世界を経て 永遠な あの黄金天国 向かい 行かねばならない
