title,body
ただ一片丹心,私行けば ついて来る 落胆もせず　心配もせず 　 振り向きもせず 神様聖霊が行く道に向かい 行かねば 私が行かねば 遠くからもついて来て 近くからもついて来る 神様聖霊が導かれる 御言葉もくださり 感動を与えてくださる だから心配せず行かねば 心も尽くし　命も尽くし 　 御心束ねて　未練もなく ただ一片丹心 　 愛の道なのだ  私もあなたも愛なのだ そうしてのみ目的を成す 御旨成す 経緯を成し遂げる 永遠だ 変わりもなく 中断もなく われら 御心 向かい 一片丹心　永遠な愛なのだ 　 愛が永遠 永遠なのだ あなた 愛しきり 私も愛しきった そうだから愛の御旨成し 歴史を成したのだ 山も越え 野も越え 多くの波をかきわけて 来てまた来て また来た 経緯が忘れないように あなたと私 呼びまた呼ぶようにした 初めも愛 終わりも愛 愛で永遠に行かねば 永遠に行かねばならない
力で存在する,ヒム ヒム ヒム ヒム ヒム ヒム ヒム ヒム 　 存在の世界は力だと 神様 私におっしゃったとおり 力だ 力が宝だ ヒム ヒム ヒム ヒム 存在の世界　地球世界も　月の世界も 力 力で存在する 　 　 われらも力だ ヒム ヒム ヒム ヒム 神様 聖霊様 われらと共にし じだ い の ひとび 時代の人々 栄光 栄光を帰して じだ い の ひとび 永遠に 永遠に栄光を帰そう 力湧く 喜び 満ちあふれる 今日も未練もない われら 顔を見合わせ笑い ひそひそと話し 応援も喉が裂けるほど叫んだ  神様 聖霊様 われらと共にし じだ い の ひとび 時代の人々 栄光 栄光を帰して じだ い の ひとび 永遠に 永遠に栄光を帰そう 力湧く 喜び 満ちあふれる 今日も未練もない われら 顔を見合わせ笑い ひそひそと話し 応援も喉が裂けるほど叫んだ
天国の生,神様 創造した天地万物 天国　地球世界 　 主に仕え共に生きるなら そこがまさに天国の生 主 共に 神様 聖霊様 仕えて 地上で引き上げ成す　黄金天国の生 神様 創造した天地万物 地球世界の天国なのだ 主を迎え 主と共に生きていくなら そこが天国なのだ 　 神様 創造した天地万物 地球世界の天国なのだ 主を迎え 主と共に生きていくなら そこが天国なのだ 　 神様 聖霊様 御子が住まう あの天の あの天の国 そこは霊たち住む天国なのだ 今日も主と共に 神様仕え 聖霊様仕えて 地上で引き上げられ 天国の生なのだ 黄金天国の生なのだ  主を迎え 主と共に生きていくなら そこが天国なのだ 　 今日も主と共に 神様仕え 聖霊様仕えて 地上で引き上げられ 天国の生なのだ 黄金天国の生なのだ
誰のために来たのか,私が世に来たのは 誰のため来たか 誰のために鐘を 鳴らすのか 私を 信じ愛し 生きる人達だ 私が世に来たのは 誰のため来たか 誰のために鐘を 鳴らすのか 私を 信じ愛し 生きる人達だ 未練もなく またやろうと 考えもせずに 一度で 一気に 一遍に 未練もなく 振るったから 東から西　南から北 稲妻のよう 　 長い 天の剣 御言葉を 一気に 振るったのだ  知って　悟りなさい 信じて ついて来い 間違いない歴史だ 私だ 信じ 勤しみ ついて来い 時間は行く 一度過ぎた時間 掴めない 二度と過ぎた時間は 死んだ 死んだ 時間だ 永遠な歴史を 作りなさい 創造しなさい 主神様 脇目も振らず 炎のような目で　われらを眺める 　 愛している あなたがやらねば
わが故郷のコノハズクが,故郷のコノハズク ソッチョク ソッチョク　夜 よ 通し 悲しくも鳴く カッコウも カッコウ カッコウ どんな経緯 いきさつ 詠じるか 吹雪 雨風 吹き荒れ 苦痛 長い歳月だ 神の一輪の歴史の花 咲かせるため コノハズクもカッコウも 鳴いたのだな  人の雲が 四季折々押し寄せて 故郷の山奥に満ちる 歴史の花 咲かせ その実 美しい 天には栄光 地には平和 愛と引き上げの理想世界だ  歴史の花 咲かせ その実 美しい 天には栄光 地には平和 愛と引き上げの理想世界だ 天には栄光 地には平和 愛と引き上げの理想世界だ
私がするなら,できない時には 見上げていた 自分なりに 歌ってもみた 今は 私 できるから 羨むことない 私に 誰がかなうだろう できなかった時は やきもきなさった 今は 私 できるから 千年 新しい歌 流れ 皆 みな 感激し 涙流す  できない時には 見上げていた 自分なりに 歌ってもみた 今は 私 できるから 羨むことない 私に 誰がかなうだろう できなかった時は やきもきなさった 今は 私 できるから 千年 新しい歌 流れ 皆 みな 感激し 涙流す 千年 新しい歌 流れ 皆 みな 感激し 涙流す
和睦 年修練会の和同曲 明け方　神様・聖霊様,よくても悪くても　われらひとつだ 過ぎた日　経緯　忘れるな 神の御旨あり　聖霊で生まれた 引き上げ成したから　目的果たした 遠くても近くても　考えひとつだ それぞれ考えるが　御旨ひとつだ 心にあること　対話で解いて 和睦し生きよう　我ら新婦だ 御言葉行えば　夢でない現実だ 隠された宝を　見つけるのは誰か この時代の秘密　我が遣わした人だ この時代の秘密　我が遣わした人だ 月明洞の御座は　神秘雄大美しい 千年間永遠だ　我らの誇り 天からの声　全世界広まる 汗で濡れた　あなたの顔撫でると 浮かぶ　あなたの労苦が輝く 永遠に輝く
私は行く,私は行く　私は行く 今日も 地の 神の宮 探し 　 海越え 大地 横切り 山越えて 行くのだ 想いは今日も変わりません 千年間 永遠だ 地上天国 千年間 成すと言うが 夢ではない現実だ  私は行く　私は行く 今日も 地の 神の宮 探し 　 海越え 大地 横切り 山越えて 行くのだ 想いは今日も変わりません 千年間 永遠だ 地上天国 千年間 成すと言うが 夢ではない現実だ 夢ではない現実だ
私のカナン,乳蜜流れる　新歴史主の胸で 美しい青い牧場で 愛する主よ　愛しい主よ 待ってた私の主 燃える太陽のよう　火を噴く火山のよう 止められず愛した 主を忘れられず　押し寄せる波のよう 愛する主のそばに 希望で今日も集まった　和睦の摂理 愛も多い　幸せな主の世界  乳蜜流れる　新歴史主の胸で 美しい青い牧場で 愛する主よ　愛しい主よ 待ってた私の主 燃える太陽のよう　火を噴く火山のよう 止められず愛した 主を忘れられず　押し寄せる波のよう 愛する主のそばに 希望で今日も集まった　和睦の摂理 愛も多い　幸せな主の世界  燃える太陽のよう　火を噴く火山のよう 止められず愛した 主を忘れられず　押し寄せる波のよう 愛する主のそばに 希望で今日も集まった　和睦の摂理 愛も多い　幸せな主の世界 希望で今日も集まった　和睦の摂理 愛も多い　幸せな主の世界
私のカナン 我的迦南,乳蜜流れる　新歴史主の胸で 奶與蜜潺潺流淌 新歷史 主的懷中 美しい青い牧場で 美麗無比 青青草原之上 愛する主よ　愛しい主よ 多麼深愛的你 所思念的你 待ってた私の主 殷殷等待 我的良人唷 燃える太陽のよう　火を噴く火山のよう 如同太陽 熊熊燃燒 如同火山 炙熱爆發 止められず愛した 無法再按捺 我對你的愛 主を忘れられず　押し寄せる波のよう 無法忘懷你的愛 人們今天 也如潮水 愛する主のそばに 滿懷希望 蜂擁過來 希望で今日も集まった　和睦の摂理 聚集到 親愛良人身邊 和睦的攝理 愛も多い　幸せな主の世界 我主的世界 充滿愛 幸福也洋溢  乳蜜流れる　新歴史主の胸で 奶與蜜潺潺流淌 新歷史 主的懷中 美しい青い牧場で 美麗無比 青青草原之上 愛する主よ　愛しい主よ 多麼深愛的你 所思念的你 待ってた私の主 殷殷等待 我的良人唷 燃える太陽のよう　火を噴く火山のよう 如同太陽 熊熊燃燒 如同火山 炙熱爆發 止められず愛した 無法再按捺 我對你的愛 主を忘れられず　押し寄せる波のよう 無法忘懷你的愛 人們今天 也如潮水 愛する主のそばに 滿懷希望 蜂擁過來 希望で今日も集まった　和睦の摂理 聚集到 親愛良人身邊 和睦的攝理 愛も多い　幸せな主の世界 我主的世界 充滿愛 幸福也洋溢  燃える太陽のよう　火を噴く火山のよう 如同太陽 熊熊燃燒 如同火山 炙熱爆發 止められず愛した 無法再按捺 我對你的愛 主を忘れられず　押し寄せる波のよう 無法忘懷你的愛 人們今天 也如潮水 愛する主のそばに 滿懷希望 蜂擁過來 希望で今日も集まった　和睦の摂理 聚集到 親愛良人身邊 和睦的攝理 愛も多い　幸せな主の世界 我主的世界 充滿愛 幸福也洋溢 希望で今日も集まった　和睦の摂理 聚集到 親愛良人身邊 和睦的攝理 愛も多い　幸せな主の世界 我主的世界 充滿愛 幸福也洋溢
私は幸せだ,人々 私を 幸せだと言う そうだ　私幸せな人だ 幸せは永遠に　幸せでこそ幸せと言う 御子　聖霊様　私幸せでしょう あなた幸せな人だ 人々 私を あれこれ言うけれど いいや　それは本当に違う 栄光の道は　苦労しても　命の道だ 御子　聖霊様　私幸せでしょう あなた幸せな人だ
私は幸せだ　 　 訳,人々は、私を見て不幸だと言うけれど いいや、私は幸せな人だ。 幸せというのは、永遠な幸せであってこそ 幸せなことだ。 御子、聖霊様、私　幸せでしょう。 あなたは、幸せな人だ。 人々は私を見てあれこれ たくさん言うけれど いいや、それは本当に違う。 栄光の道は苦労しても命の道だ。 御子、聖霊様、私幸せでしょう。 あなたは、幸せな人だ。 幸せというのは、永遠な幸せであってこそ 幸せなことだ。 幸せというのは、永遠な幸せであってこそ 幸せなことだ。 御子、聖霊様、私　幸せでしょう。 あなたは、幸せな人だ。 あなたは、幸せな人だ。
私は帰ってきた 私は走った,必ず帰ってくる わが故郷 天の聖殿に 帰ってくる 話された 神様 聖霊 おっしゃったとおり 帰って来た 天の その御旨 今日も 走り 生きた 神様 聖霊 今日も私見て 喜び 摂理史 ご覧になり 満足なさった 満足なさった  今日も 私は 走った　駆けた 　 神の体になり 聖霊の感動で飛びながら 果てなく 走った　摂理人生を 　 御旨のため 生きた 天の神様 見られ　聖霊様 見られ 　 共に 走った 私について走り　喜び生きた 日が沈むまで 月が昇り 星が照らすまで  天の神様 見られ　聖霊様 見られ 　 共に 走った 私について走り　喜び生きた 日が沈むまで 月が昇り 星が照らすまで
私を受け入れてください,明洞 ミョンドン の町の人々のよう 探していた 世の中の好きなもの　私も探した 今は悟った　私の好きなもの 今は悟った 主よ　受け入れてください 主だけのため生きる 主だけのため生きる ドキドキして求めます 御言葉行ない　愛で引き上げられ 黄金天国で　主と共に永遠に生きたい 受け入れてください 主よ　永遠に愛します  今は悟った　私の好きなもの 今は悟った 主よ　受け入れてください 主だけのため生きる 主だけのため生きる ドキドキして求めます 御言葉行ない　愛で引き上げられ 黄金天国で　主と共に永遠に生きたい 受け入れてください 主よ　永遠に愛します 受け入れてください 主よ　永遠に愛します
私の心は変わりありません,主を呼びながら見ながら 私 行きます 時には野原を 砂漠を通り 川も渡って山も登って越えて 希望満ち 私 揺れることなく行く  わが心 季節過ぎても 変わらない 神様 聖霊様 私を見られるのに わが心 どこに行く  今日もわが心 川のように とまらず吹いてゆく あの風のように 飛んでゆく　走ってゆく 　 愛は変わらないのだ 永遠なものなのです
私が道だ 命だ,私が道だ 命だ 真理だ 私について来い この世に 他の道もない ただ神が遣わした 歴史の 命の主が道だ 私について来い 私について来い 私があなたを救ってあげよう 神の御前に導いてあげよう 主神様 聖霊様は あなたを導かれる 世の命の道に 愛の道に 平和の道に 和睦の道 希望の道に 死を免れた命の道なのだ  暗い世界 死亡の世界は 遠く遠く 無知の世界だ 死亡の世界なのだ 主神様 今日も 霊魂まで 肉もすべて 命の道 永遠な道に導き 永遠に永遠に 黄金天国に導き 愛で永遠に永遠に 生きるようになさるのだ 信じて来い ついて来い ついて来い 今日も明日も 他の道 ない 命の道だ 永遠な愛の道だ 日が昇り沈むまで 月が昇り沈むまで 星出て沈み 消える時まで いつも 主神様 主と共に 聖霊様と共に あなたを導き 永遠な命の歴史の道に行かれる 今日も われら 神様 一つになり 離れもせず 別れもせず 行くのだ  愛と歓喜の世界だ 希望の歴史なのだ 変わらない永遠な道なのだ 知らない人々は 行なえないのだ むしろ 反対 反対 無視 無視 知らぬことほど 世に 悔しいことはないものだ 神様 おっしゃった 知って生きる人 神なのだ 永遠な愛で あなたを 神様 聖霊様 歌って呼ばれる 幸せな永遠な愛の人々よ 幸せな永遠な愛の人々よ
私たちの愛は永遠な愛,愛している あなたたちを愛してる わが愛は永遠な愛だ 愛している あなたたちを愛してる わが愛は永遠な愛だ 永遠な愛だ あなたも私を愛しなさい 変わらない愛だから あなたも私を好きになれ 私もあなたが好きだから われらの愛は永遠 永遠な愛だ  変わらない愛だから あなたも私を好きになれ 私もあなたが好きだから われらの愛は永遠 永遠な愛だ 天地万物すべて私のものだ あなたのものだ 永遠な愛なのだ
わが主が最高,わが主が最高だ  歌も上手　踊りも上手で 他の人は見るものない 　 見るまでもなく そうだってば わが愛は よく従い よくついて来るんだってば こんなによくできる わが主のような人が 地球村 どこにいるか 本当に上手 本当に上手 夜更けまで　眠らずに 　 ふりふり踊って　歌も歌い 本当に上手だ 　 神様 聖霊様 主が見られて 喜び 歌を歌ってくれる  このようによくやって 肉も霊も 永遠に 永遠に あの黄金天国 行く時まで 本当に 本当に 変わりもせず よくできる チャン チャン チャン チャン チャン チャン チャン チャチャチャチャン チャン チャン チャン 皆 拍手もして　肩も動かし 歌を歌うのだ 　 一緒に踊り 神様 聖霊様 主が見て われら共に 心も喜ぶように われら やらねばならない もう他の道はない 神様 仕え　聖霊様に仕え 主と共に　この世が終わるまで 　 　 変わらず 他の道に行くこともないのだ 今は この世の 誰も 誰も うらやましくない うらやましくないのだ うらやましくないのだ
私が幼い時に通っていた道は,私が 幼い時 通った道 経緯も 多かった 神様を 呼んで テドゥン山 奇岩絶壁 登り また登って わが青春 注いだ 長い歴史 過ぎるまで 天の深い秘密 悟り 悟って 分かった 全世界 深い秘密を 聖霊が 話された 今は 行かなければ 暗いあの世に 向かい 行って 教えなさい 叫び 伝えよ 話された
私はあなたを信じ あなたは私を信じよう,私 あなた 信じ あなた 私 信じよう 過去を問わないで 経緯は話そう 夜が明けるまで あの月が 西の山 うろつくまで 夜明け 来るまで 互いの経緯を 話もしながら 聞いてみよう ついて来い ついて来たら　あなた分かり 　 私も分かるようになるだろう 神様 どれだけ長い歴史 待っていたか  今は二心 ふたごころ 抱かず 私と心一つで 行かねば 走らねば 勤しみ 日が昇り沈み 夜 来ても 行くべき道だ 行かねば 走らねば 勤しみ 日が昇り沈み 夜 来ても 行くべき道だ
私のそばにいらっしゃるから,聖霊様 どこですか 会いたくて呼びます 聖霊よ 返事はないけど そばにいるから 心に響く 今日も忘れず 愛して生きてゆく 主よ どこにいますか 愛しく会いたくて 呼びます 主よ 返事 ないけど そばにいるから話します どこに行っても共になさる主 永遠に愛してる  神様 どこにいますか 私のそばにおられ 炎のような目で ご覧になるから 愛して感謝し賛美します 今日も新婦の生を 永遠に愛します 今日も新婦の生を 永遠に愛します
私は主だけを思います,今日も 生きてゆくなら 私 主だけ 思います 主に会えても 会えなくても 私 どこでも 主だけ 思って 生きてゆきます おぉ 主よ 私と 今日も 共にさえするなら 私 満足です　感謝します 　 喜び 愛を 燃やして行きます 愛は 理論ではなく　実際なのだと 主はいつも おっしゃいましたね 愛する主よ　いつ会えるか 未練は 断ち切れません 過ぎた日 行き来し　会える道が あるなら 立ち止まってください  今日も 生きてゆくなら 私 主だけ 思います
私を呼んでください,月明洞に 主が来られたら 呼んでください 摂理史に 主が来られたら 私を 呼んでください 待ちに待っていた 主が来たから 呼んでくださった 主神様 待っていた主も来て 御言葉も来た 月 昇り 星 昇るまで 過ぎた日 会えなかった時の 長い経緯 その話を 聞きたいです 言わないけれども その経緯には あまりにも深い経緯が あるでしょう 私たちもそうです  過ぎた日 患難 迫害 困難 厳しい雨風 吹雪に 再び われらが 主に 会えるのか 理想世界 広げられるか 考え込んでた時が 浮かびます 思い出します このよう 歴史が 覆っていくとは 本当に 知らなかった 神様は やはり 全治全能 偏在なさる 主も やはり その御力と 根気強く 最後までなさる その姿 私たちは一言 素敵だ 主は格好いい 本当に 信じて従ってよかった 今日は悟りました
私と共に同行なさいます,聖霊様 私と同行なさいます 昨日も今日も私と同行なさいます どこに行っても何をしても 私と同行なさいます どこに行っても私と同行なさいます 何をすべきか 聖霊様 われらに知恵で判断させてくれます 万物見せて判断をうまくさせてくれます  いつも自分の考えではなく 聖霊の中で悟らせるまま 行なうべきです 正しく分別して やってこそ 喜び希望もなされます 今日も聖霊様 万事すべてを 御旨どおり 分別するよう われらに熱く働きかけてください わが思い尽くし 愛の心で今日も生きてゆきます 生きてゆきます
神様がくださったすべてのもの,神様が 用意して くださった すべて 聖霊様のよう 美しく きれいだ 貴く貴い宝です 聖三位に 感謝と栄光 帰そう その形 形象が 不思議だ 神様 聖霊様 御子 行なわれた 経緯 真 しん に 深く 感激だ その経緯のよう 喜び　愛しなさい  神様が 用意して くださった すべて 聖霊様のよう 美しく きれいだ 貴く貴い宝です 聖三位に 感謝と栄光 帰そう その形 形象が 不思議だ 神様 聖霊様 御子 行なわれた 経緯 真 しん に 深く 感激だ その経緯のよう 喜び　愛しなさい 聖三位に 感謝と栄光 帰そう その形 形象が 不思議だ 神様 聖霊様 御子 行なわれた 経緯 真 しん に 深く 感激だ その経緯のよう 喜び　愛しなさい その経緯のよう 喜び　愛しなさい その経緯のよう 喜び　愛しなさい
感謝と恵みの生,神様 聖霊 御子 われらを愛して 今まで全てを惜しまずくださった 主とその恵みに 感謝し日々 忘れず 喜び 生きてゆこう  不可能を為 な してくださった 今まで全て得たものが 証する 見せる 恵みに感謝 感激し 変わらず 愛して 生きてゆこう  神様 聖霊 御子 われらを愛して 今まで全てを惜しまずくださった 主とその恵みに 感謝し日々 忘れず 喜び 生きてゆこう  不可能を為 な してくださった 今まで全て得たものが 証する 見せる 恵みに感謝 感激し 変わらず 愛して 生きてゆこう  主とその恵みに 感謝し日々 忘れず 喜び 生きてゆこう
神様聖霊様喜ばせよう,神様 聖霊 御子 愛するから力湧く 嬉しい 愛が満ち溢れる 感動の歴史だ チャン チャンチャンチャン チャンチャンチャンチャチャチャチャン チャンチャンチャン  神様 聖霊 御子 愛するから力湧く 嬉しい 愛が満ち溢れる 感動の歴史だ チャン チャンチャンチャン チャンチャンチャンチャチャチャチャン チャンチャンチャン われら皆 手を叩き 歌おう 立ち上がり踊って 神様 聖霊様 喜ばせよう チャン チャン チャンチャンチャンチャンチャン チャチャチャ チャンチャンチャンチャン チャーン チャーン チャチャン チャン チャンチャンチャン われら皆 手を叩き 歌おう 立ち上がり踊って 神様 聖霊様 喜ばせよう  チャン チャン チャンチャンチャンチャンチャン チャチャチャ チャンチャンチャンチャン チャーン チャーン チャチャン チャン チャンチャンチャン チャン チャン
考えで生きる,考え次第で 運命が変わる 決心次第で 人生が決まる 　 　 人は それぞれ 考えで生きる 全能なる神を いつも考えよ 　 　 実践が大事だ 願ったものを得る 聖霊その都度 感動で話される 　 　 考え次第で 天国か地獄だ 御言葉により 歴史 分かれる 　 　 引き上げ 黄金天国 新時代 主の歴史 人は気分で 考えが変わる 　 　 考えを深く 確認し実践せよ 主は話され 聖霊 感動くださる 　 　 いつも神様は 考え見られる
環境 状況 立場 雰囲気に溺れるな,環境 状況 立場 雰囲気に溺れるな 人々 誘惑する 興奮剤だ 治めなさい 三位の御心 御言葉通り 主管しなさい しなければ 後悔する 聖霊 話された 三位の状況 雰囲気 立場 環境だ 御言葉の内容 環境 雰囲気だ 永遠な愛と 幸せな 黄金天国の生だ  治めなさい 三位の御心 御言葉通り 主管しなさい しなければ 後悔する 聖霊 話された 三位の状況 雰囲気 立場 環境だ 御言葉の内容 環境 雰囲気だ 永遠な愛と 幸せな 黄金天国の生だ 永遠な愛と 幸せな 黄金天国の生だ
隠されていたもの 明かす,神の時に隠されてたもの あらわになる 聖三位 主と行う 皆 みな 見て悟りなさい 聖霊 感動くださり証なさる 愛と引き上げ 聖三位と主が行なった 創造の目的 成した 待っていた 千年の婚宴 黄金天国 見るほど美しい 主の愛は 美しく永遠だ 三位の愛は 美しく永遠だ
